{"code": "F33.0", "label": "Trouble dépressif récurrent, épisode actuel léger", "description": "Trouble caractérisé par la survenue répétée d'épisodes dépressifs, l'épisode actuel étant léger [F32.0] , en l'absence de tout antécédent de manie.", "note": "", "inclusion_notes": [], "exclusion_notes": [], "parent_label": "Trouble dépressif récurrent", "full_description": "Code: F33.0\nLibellé: Trouble dépressif récurrent, épisode actuel léger\nDescription: Trouble caractérisé par la survenue répétée d'épisodes dépressifs, l'épisode actuel étant léger [F32.0] , en l'absence de tout antécédent de manie.\nClasse parente: F33 - Trouble dépressif récurrent\nSous-classes: F33.00, F33.01"}
{"code": "F60.5", "label": "Personnalité anankastique", "description": "Trouble de la personnalité caractérisé par un sentiment de doute, un perfectionnisme, une scrupulosité, des vérifications et des préoccupations pour les détails, un entêtement, une prudence et une rigidité excessives. Le trouble peut s'accompagner de pensées ou d'impulsions répétitives et intrusives n'atteignant pas la sévérité d'un trouble obsessionnel-compulsif.", "note": "", "inclusion_notes": ["Personnalité :", "- compulsive", "- obsessionnelle", "- obsessionnelle-compulsive"], "exclusion_notes": ["trouble obsessionnel-compulsif [F42.-]"], "parent_label": "Troubles spécifiques de la personnalité", "full_description": "Code: F60.5\nLibellé: Personnalité anankastique\nDescription: Trouble de la personnalité caractérisé par un sentiment de doute, un perfectionnisme, une scrupulosité, des vérifications et des préoccupations pour les détails, un entêtement, une prudence et une rigidité excessives. Le trouble peut s'accompagner de pensées ou d'impulsions répétitives et intrusives n'atteignant pas la sévérité d'un trouble obsessionnel-compulsif.\nClasse parente: F60 - Troubles spécifiques de la personnalité\nInclusions:\n  • Personnalité :\n  • - compulsive\n  • - obsessionnelle\n  • - obsessionnelle-compulsive\nExclusions:\n  • trouble obsessionnel-compulsif [F42.-]\nLibellés alternatifs: Personnalité obsessionnelle; Personnalité compulsive; Personnalité obsessionnelle-compulsive"}
{"code": "B96.6", "label": "Bacillus fragilis, cause de maladies classées dans d'autres chapitres", "description": "", "note": "", "inclusion_notes": [], "exclusion_notes": [], "parent_label": "Autres agents bactériens précisés, cause de maladies classées dans d'autres chapitres", "full_description": "Code: B96.6\nLibellé: Bacillus fragilis, cause de maladies classées dans d'autres chapitres\nClasse parente: B96 - Autres agents bactériens précisés, cause de maladies classées dans d'autres chapitres"}
{"code": "B08.1", "label": "Molluscum contagiosum", "description": "", "note": "", "inclusion_notes": [], "exclusion_notes": [], "parent_label": "Autres infections virales caractérisées par des lésions cutanéomuqueuses, non classées ailleurs", "full_description": "Code: B08.1\nLibellé: Molluscum contagiosum\nClasse parente: B08 - Autres infections virales caractérisées par des lésions cutanéomuqueuses, non classées ailleurs"}
{"code": "M99.88", "label": "Autres lésions biomécaniques - \" Cage thoracique \"", "description": "", "note": "", "inclusion_notes": ["costochondrale, costovertébrale, sternochondrale"], "exclusion_notes": [], "parent_label": "Autres lésions biomécaniques", "full_description": "Code: M99.88\nLibellé: Autres lésions biomécaniques - \" Cage thoracique \"\nClasse parente: M99.8 - Autres lésions biomécaniques\nInclusions:\n  • costochondrale, costovertébrale, sternochondrale\nLibellés alternatifs: costochondrale, costovertébrale, sternochondrale"}
